	text	label
1701	let hope one day landfill dont look like anymore	0
1702	letter cool	0
1703	letter mental disorder	1
1704	mexican sub culture california	0
1705	get hell	0
1706	han forget ze flammenwerfer get gustav	0
1707	love god help change diaper baby crap leaking	0
1708	first take moment realize fuck talking	0
1709	rock paper scissors throat punch	0
1710	hi im nate im lesbian recovery	0
1711	human say good girl already know	0
1712	must way victimizes	0
1713	real man load dishwasher every night	1
1714	race cant homicide	1
1715	weeeeeee back border go	0
1716	nevermind ill wait	0
1717	remove polish chemical one bat eye remove polish chemical everyone loses shit	1
1718	child protective service take away childrenfrom parent dont vaccinate theyre perfectly fine	0
1719	da look dog gave mina fucked tranny together	1
1720	sure shes cute car still dirty	0
1721	im black kid face	0
1722	dont park close truck boy	0
1723	youre special kinda nut arent	0
1724	look youre black celebrate july	0
1725	cant pay child support person	0
1726	remember leftover fride realize someone ate got home	0
1727	gay way home pride week	1
1728	year ago slave would used farming	0
1729	smile birthday	0
1730	smh kid day rely much technology	0
1731	looking forward night	0
1732	puzzle level expert	0
1733	two gay black men get married adopt baby father supposed abandon family	1
1734	dont know deal black people guess ill take shot	1
1735	asked see thing point view looked kitchen window	0
1736	one piece shit wont flush	1
1737	cant victim school shooting youre school shooter	1
1738	god love child	0
1739	see cat let get lunch	1
1740	care truck care well truck blow gasket dude	0
1741	proof dont fly plane building destroy nation	0
1742	islam love ariana grande yeah youre goat	1
1743	weve peace japan since time make peace islam	0
1744	virgin sheep running horny muslim	1
1745	youre constantly referring skin color people skin color maybe youre racist	0
1746	little one brings home first girlfriend	1
1747	black people criminal	0
1748	israeli knock teeth yr old girl	1
1749	think im cute aww get otter	0
1750	one like black people	1
1751	call retarded jew auschwistic	1
1752	conjoined twin abby brittany	0
1753	one touch heal everything dont touch u disability	1
1754	white people leave house like	1
1755	privledge carry anything	0
1756	bet god one u didnt even raise son	1
1757	world call love god call abomination	1
1758	pork dripping rub way keep child safe rotherham	0
1759	aint allah back girl	1
1760	many nail lesbian coffin none tongue groove	1
1761	told transgender actually mental illness called delusional psychosis	1
1762	saw cotton picker thought would field black people	1
1763	hitler homicide commited genocide	0
1764	boy start suckin cock anyways accidently pick tranny hooker	1
1765	muslim terrori terrorist muslim	1
1766	islam religion peace stop criticizing religion	0
1767	magic makeup astonishing	0
1768	bitch please im native american	0
1769	talking ape	1
1770	know princess diana dandruff oh yes yes found head shoulder dashboard	0
1771	israel israel mak ko hijau mother terrorism	1
1772	handjobs sold separately	1
1773	head teacher given power ban burqa british school share want full ban britain	1
1774	aaaaaaaaaaaaaah dick stuck drawer	0
1775	hardest part breaking japanese girlfriend drop bomb twice get	1
1776	white family river	0
1777	breaking news people dont believe bullshit anymore	0
1778	arrest george soros crime europe	0
1779	forgot put time sitting whole day	0
1780	head diaper required shit brain	1
1781	still suck dick faggot	1
1782	bull shit evolved form ape man	1
1783	yes know trump said mexico pay wall mexican wall boy good	1
1784	trump starting wwiii turn gun go snort rubber maggot	0
1785	market day	0
1786	dad go suicide bombing fuck sister turn mother	1
1787	rudolf hess edited mein kampf adolf hitler make first grammar nazi	0
1788	weree blow stupid british people e letting u country	1
1789	there joke somewhere indian socialist smeller mistress homosexual terrorist lover walk bar	1
1790	dont like thick girl fuck wrong	0
1791	difference moderate muslim radical muslim follow allah kill moderate muslim follow allah kill radical muslim	1
1792	chinese food show completely uncooked	0
1793	broken dishwasher sale rent	0
1794	king kong	0
1795	blind never stopped ray charles achieving dream	0
1796	aunt gon na make white devil pay grandmother owning slave	1
1797	bitch please go back england	1
1798	homosexuality genetic get passed	1
1799	fake fit cant life hard muchreal shit	0
1800	single black mother multiple child different men created modern day ghetto	1
1801	simple grammar question leeroy cames end sentence parole	0
1802	muslim congress muslim	1
1803	pelosi warns future democratic president could declare national emergency ban gun seem recall previous government tried shot	0
1804	nice try woman go back kitchen	1
1805	didnt hear question answer white people racist	1
1806	maga bois see trump coming suppressor supposed chosen one	0
1807	muslim guy heaven	0
1808	boy killing innocent people bomb blast	0
1809	promise promise promise deliver	0
1810	ever notice christian horrible driver	1
1811	allowed kid made choice bitch live	1
1812	wea yo top lip doe missing like yo dad	0
1813	putting load dishwasher	0
1814	dear diary today op faggot	1
1815	transgender shit getting outta hand	1
1816	put brake fluid meth stop whenever want	0
1817	transgender gay doesnt get attention rightfully deserve	1
1818	kill elect u congress stupid infidel	1
1819	virgo youre white trash quite frankly	1
1820	sense humor dark people worried	0
1821	parent lie child celebrate thanks giving christmas easter holloween nerve tell child dont ever lie	0
1822	idea im life	0
1823	today order handle strong black woman need leash bitch feminist black feminist	1
1824	expensive gas bill nazi coming	1
1825	love god change diaper head crap leaking	1
1826	think crakkka today different crakka year ago youre damn fool	0
1827	treat way treat vacuum cleaner stop sucking change bag	1
1828	irony meter exploded	1
1829	mississippi wind chime	0
1830	indictment nothing thanks white privilege	1
1831	ci girl	0
1832	toaster fire	1
1833	man getting arrested la pd	0
1834	cant afford new dishwasher hit rusty one make work	0
1835	josh prevent wildfire dammit josh one job	0
1836	grandma see first time whole week he fucking big meirl	0
1837	black life really mattered theyd stop shooting eat	1
1838	youre dating somebody ex somebody dating youre ex ex getting somebody ex life xmen	0
1839	never know crazy truly give good dick	0
1840	anyone paying attention know biggest threat innocent person life america police like agree	0
1841	well judge made remember first said kenyan	0
1842	last year tyrone got new job started building credit spending time kid something amazing started happen	1
1843	voice change history better orworse	0
1844	anne frankly dont care	1
1845	money evil give u	1
1846	wasnt fault truck tranny issue	0
1847	loses hair chemo doesnt shave pussy	1
1848	beat dre beat tyrone	0
1849	kill kill	0
1850	nein shit given	0
1851	meanwhile isi strip club	0
1852	mr president epstein still alive	0
1853	chevy guy go muddin ford guy go muddin	0
1854	step ladder never knew real ladder	0
1855	name todd retodd	1
1856	cover wife head toe sexual thought satanic blow someone promised virgin fck	1
1857	im going real honest washed motherfucker coming	0
1858	kill white man ooo wwe fan	1
1859	youre immigration splendid leave	0
1860	remember illegal alien wanted go home want free food healthcare housing	0
1861	make citizen make family	1
1862	transgenderism mental illness sociopathic tyranny identity mandating public acceptance	1
1863	dishwasher broken take back walmart get new one	1
1864	smell shit youre sure arse hand	1
1865	one time camp got baked	1
1866	said glass juice gas jew	1
1867	greeting time run	0
1868	handful rich people run country handful politician	0
1869	islam instill terror heart un believer smite ye neck smite fingertip quran	0
1870	think funny haggle overprice hooker youre going kill anyway	0
1871	thats gayer cum mustache	0
1872	people keep calling terrorist identify firework	1
1873	give holy flag praise lord enslaver	0
1874	steak black stole television	1
1875	look sonanother terror attack peaceful bear	0
1876	went walmart bit fun	0
1877	jewish friend smell stash coin public	0
1878	hump day oh fuck	0
1879	youre batchelor party realize money stripper gstring grandma picture	0
1880	runner	0
1881	here obama let drink	0
1882	un add another million holocaust death toll	0
1883	cohen history intentional dishonesty lying congress lying irs lying wife birth lying bank even took million insider consultant without informing trump dems trust testimony truthful lol	0
1884	whydo keep liberal fight fight kill	0
1885	sister bang black guy get knocked literally become monkey uncle	1
1886	husband give massage aaaand dick	0
1887	troop respect alpha	0
1888	one hour ill hour left work mere hour	0
1889	reincarnation mean press x respawn	0
1890	either fuckin im fuckin	0
1891	sleep hunbashing	0
1892	think need protection people people youre special kind stupid	0
1893	time rely upon enemy job youre bad shape	0
1894	never dated cuzn fucked never dated	0
1895	youres high fuck hear loud sound fuck	0
1896	married brother commit immigration fraud	0
1897	like hot l swapped girl penis	1
1898	thats happens say wan na catch hand	0
1899	say swear like sailor say please thank like saint im complicated	0
1900	soi guess cant give old fashioned bout bj	0
1901	border agent texas aprehend span minute illegals know issue illegal immigration fix separate family	0
1902	black people damn yall crackas bitch yall sensitive lmao mayo as crackas white people black people	1
1903	born time mlk jr though think different era	0
1904	hater arrived	0
1905	die getting hoors realise goat	1
1906	free dishwasher missing part	0
1907	great news iq test came back negative	0
1908	michelle obama sighted sun bathing afghanistan	0
1909	squad hasnt done squat congress	0
1910	happy birthday ya lil goat fucker	1
1911	whatever auburn fan	1
1912	need someone look way looking candy	0
1913	batman thank god youve arrived	0
1914	see muslim muslim see u	0
1915	run away shit hole country islam establishes islam turn new country shit hole	1
1916	try send killer kill dante dante inferno	0
1917	documentary kkk premier wednesday fox	0
1918	muslim woman wear mask easier hide fur	1
1919	look son another terror attack peaceful muslim	1
1920	say white people culture	0
1921	got big booty shes classy	0
1922	helped put together signed billion dollar deal fund border wall trump want billion border wall well im gon na bitch cry piss moan he republican want	0
1923	porkistani nibba need sex let handle	1
1924	believe ive got virgin goat sell	0
1925	democrat agenda impeach trump raise tax shield illegals gun control weaken america share immediately enough	0
1926	knowing white people thats probably baby father	1
1927	one time camp got baked	1
1928	dropped jewish kid wrong camp	1
1929	american cop graduate police academy let black man come forth let murder done upon	1
1930	ever feel remember people whole life	0
1931	im arresting public intoxication	0
1932	im going home im russian	1
1933	youre high make syndrome syndrome	1
1934	three k day keep fat haha	0
1935	islamomopolitan special feature know place survive woman daily beating men treat like cattle	1
1936	put sunblock doesnt protect harmful ray	0
1937	fuck shit fuck straight fuck mountain riding fuck horse land awwww hell	0
1938	obamas fbi break rule policy broke law make mistake committed crime	0
1939	married brother commit immigration fraud make illegal alien ineligible congress deportable ice	1
1940	dare people make fun peaceful religion	0
1941	love everything everybody except squirrel hate squirrel	0
1942	head diaper required shit brain	1
1943	youve hungerstruck	0
1944	wing wing wing herro thats racist	1
1945	neverforget ancestor went christianity even think dating white man disgust	1
1946	u want fuk hey dear love u show ur pussy u beauty	0
1947	parent tell kid angel whispering lucifer	0
1948	making fan everywhere	0
1949	girl looking like gallon arizona iced tea	1
1950	hate rapist child molester people think race superior oh hate muslim huh good shit	1
1951	last time trump supporter say relocate mexican saying exterminate mexican	1
1952	finally finding right tutorial need indian accent	1
1953	life handed lemon fucked gave lemonaids	0
1954	stupid bitch race	0
1955	can not allow birth control run child molest	0
1956	hey mom goat asshole inside	0
1957	black people criminal	1
1958	immigrant illegal alien	0
1959	white power	1
1960	new democratic flag	0
1961	ramadan begin may bombathon end june	1
1962	nice boob guess tranny omg shemale	1
1963	care mexican offended american offended illegal immigration	1
1964	terrorist trojan horse enemy state	0
1965	fuck already meme	0
1966	youre asking people cent day money fly make commercial	0
1967	hoe backwash drink	0
1968	life never given lemon given anger issue anxiety love alcohol serious dislike stupid people lemon	0
1969	walk welfare office hello monkey	0
1970	putting bow pet	0
1971	saving refugee	0
1972	greatest news manufacturing century	0
1973	hitler joke rude anne frankly dont care	1
1974	start choke uncle know heimlich maneuver	0
1975	heard get free steroid australia please help feed house poor defenceless refugee dont racist let	1
1976	muslim plague spreading like herpes	1
1977	find there opening role chewbacca	1
1978	muslim party	0
1979	face make pussy get hard	1
1980	ex ask help	0
1981	adult understand hijab big part culture	0
1982	enjoyed watching king kong movie	0
1983	racist people one cryingracist time	0
1984	best thing ethiopian blowjob know shes gon na swallow	1
1985	guy say love really mean girl say love want sleep hurt feeling	0
1986	poster new play	0
1987	officer	0
1988	soconvert islam die say fuck itlets roll	0
1989	chiken black one going eat	0
1990	luckily shes fat never would fit	1
1991	human asks knocked everything table awiens	0
1992	moment changed world	0
1993	enjoying day beach	0
1994	suffer disorder speak truth piss people	0
1995	let tranny suck completion billion dollar yes	1
1996	dont ever think got away rat shit said snake shit good memory alot patience	0
1997	married brother commit immigration fraud make illegal alien ineligible congress deportable ice	0
1998	heard daughter telling friend curious would like date black guy showed	0
1999	whats difference cow holocaust cant milk cow year	1
2000	trump say ill pay american agreeignt wall built	0
2001	guy finger cat	0
2002	telling girl jerk ultimate compliment free porn chosen	0
2003	shit get real	0
2004	breaking rep ilhan omar broke federal tax law filed tax jointly man legally married	0
2005	moment talk allah	0
2006	chinese food show completely uncooked	1
2007	act someone get offended real shit oh im sorry bitch	0
2008	finally stopped drinking good drink evil	0
2009	hey man got ta go home parent fighting	0
2010	si youre fatheruncle bro im gon na funcle	0
2011	mother love like	0
2012	cumshot jewish girl face	1
2013	friend coming see crazy friday night	0
2014	new zealand edition call duty	1
2015	say dude blew tranny	1
2016	head diaper required shit brain	1
2017	driver supposed speeding ticket co officer keep collect four get bicycle	0
2018	see child gay parade half naked twerking everyone celebrating ernie prepares commit hate crime	1
2019	someone help take care could happen didnt	0
2020	felt cute might pray later idk	0
2021	putn ham mohamed	0
2022	pray god	0
2023	idiot threw shit wrong keeper	0
2024	would win	0
2025	white child raped muslim must shut mouth good diversity say corbynite mp naz shah sack sicko labour mp naz shah	1
2026	here snowflake shocked president promised	0
2027	think god done sending fuck boy life another one	0
2028	hahahaha fuck feeling	0
2029	tell cant go chicfila sunday mean	0
2030	let see get scared bring as cut head	0
2031	learn hunt valuable skill	0
2032	heroin destroying white community keep good work heroin	1
2033	cosby trump guy one convicted matt lauei harvey weinstein bill oreily charlie sheen	0
2034	dont always see muslim public swimming pool always tap sign	1
2035	obama voter	1
2036	top trynna catch titty	0
2037	girlfriend say treat like princess	1
2038	travel size coffee maker	0
2039	selling anique farm equipment still work run like champ serious inquiry	0
2040	horrifying photo nuclear bomb	0
2041	woman arrested traffic cop	0
2042	chelsea clinton ugly give head count anal	0
2043	milkshake brings tards yard	1
2044	excuse let go celebrate	0
2045	discriminate say promotion homosexual lgbt way life child	1
2046	let play game flag	0
2047	im pregnant boy abortion	1
2048	color mental disease	1
2049	year old who going ask	0
2050	lizzie velasquez born rare disease motivational speaker	0
2051	im camp still cant concentrate	1
2052	laugh u crime rate	0
2053	whole family want go party boat	0
2054	week old fetus legal kill state imagine wrapped bacon	0
2055	fuck say	0
2056	please consider donating water child need	0
2057	unless life also give water sugar lemonade gon na suck	0
2058	weekend finally	0
2059	guy read diary wtf	0
2060	ethnic jesus	0
2061	sunset piazza vittorio islamic community commemorated public prayer	0
2062	illegal alien american american citizen aoc	0
2063	run antifa protestors hear one dragged	1
2064	fast runner	0
2065	girlfriend freaked gave blowjob insisted roleplaying year old fucking weird gross like youre going couple year anyway whats rush	0
2066	bruce jenner puppy	0
2067	nahir nahir born germany nahir german fluffy fluffy born horse stable fluffy horse	1
2068	meanwhile isi strip club	0
2069	let clear treasonous piece shit	0
2070	finally snap actually kill year saying wan na die friend crazy son bitch	1
2071	whoring pray bitch religion youve never followed look like	0
2072	didnt dont like leave people leave obama president	0
2073	find there opening role chewbacca	1
2074	youre wizard motherfucker	0
2075	thread need bacon	0
2076	squad get lit	1
2077	chicken rubbery goodyear called asked recipe	0
2078	get see bill cosby double vision raped	0
2079	move away india find cant shit street	1
2080	liberal privilege liberal privilege kept prison	0
2081	brett kavanaugh grabbed penis	0
2082	stock public torture device immobilized foot punished person	0
2083	hearing american people correctly want hand mean protection make easier terrorist come country gotcha	0
2084	shit dishwasher broken	1
2085	made rice krispies way kellogs	0
2086	cotton candy make theme park wonderful	0
2087	youre protesting man visiting uk protesting woman return uk youre practicing freedom speech	0
2088	oh god im never drinking	0
2089	country forced keep mouth shut im free talk trash country hope change country im forced keep mouth shut	0
2090	israel target practice one child eye mistake one hundred fiftynine policy	1
2091	new boyfriend dandruff give head shoulder give shoulder	0
2092	heard rat problem barn time clean house	0
2093	one white cop he black im assuming he evil	1
2094	hey met crazy grenade blow maybe	1
2095	feeling get home finally poop	0
2096	mohammed pedophile rapist true story	1
2097	youre gon na go boating make sure proper flotation device	1
2098	bent like made sure felt lord inside	0
2099	kid going rob country blind expense people voted theyre going love believe bigly	0
2100	got problem chromosome one	1
2101	dont want kiss dont know girlfriend mad	0
2102	still wondering sweating watching cop	0
2103	muslim people use km per hour instead bomb per allah hu akbaar bomb people	1
2104	want rib chinese person want rib made house pet chinese person	0
2105	first gay pride parade cant wait making history	0
2106	beef raw eating salad	0
2107	musslamic democrat ilhan omar threatened member congress shes told several republican shell send shawarma give taste culture share say arrest	0
2108	white cop kill black man black man kill black man	1
2109	fifth wife eats grass another guy hand	0
2110	stuff jewish chicken give good roast	1
2111	mlk giving inspirational speech	0
2112	dont always jihad kill disabled	1
2113	co look tell crew getting mail next ra	0
2114	two powerful woman country	0
2115	teacher alright class take calculator mohammed	0
2116	shark dont attack think whale shit	1
2117	october year im gon na get nut november november fucking lie	0
2118	dont fool bomb	0
2119	told make fb pregnancy pic wife amused mistake happy little accident	0
2120	muslim see u staring barrel see muslim	1
2121	think youre dont answer phone youre actually	0
2122	go back sleep government control	0
2123	difference violating muslim muslim dont get confused	0
2124	scented pokeballs	0
2125	hurry barack home soon	0
2126	lebanon islam islam dont worry islam take therell golden age apparently	0
2127	dishwasher broken take back walmart get new one	0
2128	dont text im meeting	0
2129	sad world history	0
2130	native american woman	0
2131	harder harder thats good boy	1
2132	cute getting ready start kid life bad shes already fkn dead raped murdered illegal immigrant	1
2133	entire world great war killed million germany got ta pump number	1
2134	yes man right could killed jew left let know killing	1
2135	good day taking selfie	0
2136	want beause love need mix breed preserve specie	1
2137	destroy patriarchy simple eat	1
2138	know going serious blow job put hair manbun	0
2139	notice kenyan skidmark silent mueller report	1
2140	last time let jr feed	0
2141	drive car hit gas	1
2142	wave hello make someone smile	0
2143	every life precious	0
2144	best gamer ever million kill death	1
2145	go ahead report cant un unbutt hurt truth	0
2146	broken dishwasher sale rent	1
2147	making decent coffee	0
2148	burning horrific event history	0
2149	im saying hate donald trump id unplug life support charge cellphone	0
2150	goat tell aint pil	1
2151	successfully shot muslim mosquee isi doesnt claim assault	1
2152	whats wrong mad oh dont food suck	0
2153	hear wiretap barry said really going make america great	0
2154	laugh goatfucker	1
2155	dog watched many black family	0
2156	anybody got idea immigrant	0
2157	cant wait cut cake	0
2158	ignorant people see rashida tlaib	0
2159	joe biden fought side side racist robert bird stop school desegregation groper joe gave eulogy kkk leader funeral	0
2160	coke smile regen always coca cola coke add life nevermore coca cola	0
2161	ignorant history already march life already disarmed	0
2162	hate make u stronger	0
2163	got new slow cooker today	1
2164	told could become anything became scarecrow	0
2165	former first lady interview	0
2166	felt cute might kill toddler later idk	0
2167	drinking wine bad drinking camel piss good	0
2168	mexican like hear friend kid birthday party	1
2169	kid say stop youre gon na get hurt second later	0
2170	every man need decent coffee maker	0
2171	take trash trailer park white trash forever white trash	1
2172	group sex mohammed tired	0
2173	thanks visiting	0
2174	shit fucking eagle come nowhere	0
2175	men like dog excited see clue youre mad	0
2176	woman deserve equal right support	0
2177	piggy want say wonderful day	0
2178	fleshlight	1
2179	cant decide whether feel sorry man hate	0
2180	asks get top ride meat doesnt know youre gon na jam butthole take soul	0
2181	try catch dark type pokemon	0
2182	muslim attack prepared fight back	1
2183	dark humor like hitler people call wrong find completely justified	1
2184	know family child everything	0
2185	much holla cost	0
2186	whats difference cow holocaust cant milk cow year	1
2187	say gunman every time there mass shooting	1
2188	girl dy organ body stay warm dick	1
2189	whats deal palestinian people there palestine arent people	1
2190	control narrative still think shooting done black people playing chess checker	0
2191	first time sweet beautiful baby boy ever brings girl home meet dont go back home whore island	0
2192	patrick kenneth x scandal lebron james	1
2193	s officer searching house jew hears shuffling floorboard fun begin s stand seriousnazis	1
2194	let salute hitler great said would killed jew world kept show world killed	1
2195	feeling long day work	0
2196	many like hero	1
2197	mum tell rinse vegetable	0
2198	crisis hotline help wellim feeling suicidal great fly plane	1
2199	right	0
2200	look father sell goat	1
2201	feeling cute might kill million lateridk	0
2202	basic white girl natural habitat imagine heaven look like womenwholovewine wineaisle target whitegirlwasted	0
2203	dont know gave child whistle find kill	0
2204	blow job day keep side chick away sasha grey	0
2205	enemy within ilhan omar linda sarsour rashida tlaib enemy infiltrated congress	0
2206	rich nation know better tolerate islam ever wanted visit africa keep amgola mind	1
2207	hollow coater	0
2208	ran past full retard went straight potato	1
2209	liz krueger ny state democratic senater want infiltrate nra take yeah like infiltrated mcdonalds year	0
2210	hide seek european champion	1
2211	dont know deal criminal guess ill take shot	0
2212	favour bringing swedish woman america refugee instead muslim please like share	1
2213	place ugliest tranny	1
2214	homosexual	0
2215	finishing race passion	1
2216	every one afraid man	0
2217	let play chew toy	0
2218	hitler leader nazi	0
2219	call black guy tree briefcase black guy briefcase	0
2220	playstation vr required food simulator	0
2221	dont always heat stroke get frostbite week know im kentucky	0
2222	terrible day please post offensive joke comment feel like sulking also laughing	0
2223	god forgive matter youve done sweet	0
2224	snake mouth make fucking sense	0
2225	hey look im serial pedofile	0
2226	thing white people mass shooting smoke meth fuck family member suck sport steal black fuck animal lie racist	1
2227	cruise give monkey much liqour	1
2228	saddle motherfucker time play cowboy	0
2229	pro oxygen sweet beautiful oxygen liberal	0
2230	friendship everyone	0
2231	stop asking dont tell money went collected billion haiti built house law little people	0
2232	told onramp designed reach speed traffic merging	0
2233	action killed innocent people	0
