	text	label
0	muslim sex goat wipe ass hand drink camel piss im unclean one	1
1	taking nap walmart	0
2	shes mad want attention	0
3	he marrying why fucking goat	0
4	think beautiful beck yet shes getting	0
5	islam love ariana grande yeah youre goat	1
6	excuse anyone wear dress	0
7	told goat fucker suck star spangled dick	1
8	german british danish austrian diversity apparently dont guy iraqi pakistani syrian egyptian	1
9	eat as say dont suck dick wayment	0
10	chillin chromies	1
11	shes trying hardest make cum already visited favorite goat	1
12	since thousand black peoplehave murdered black people thats soldier killed iraq war korean war vietnam combined see problem	1
13	afghan muslim men make look like girl sex little boy stop abuse	1
14	hahaha fuck bitch	0
15	knew country full white trash	0
16	messed accidentally make baby cant accidentally make pizza	0
17	oh youre tired antitrump post dont pray stop	0
18	making quick snack	0
19	felling cute might fuck goat later idk	1
20	dont rude folk go page wish happy easter	0
21	serb kid start talking mad shit	1
22	little one brings home first girlfriend	0
23	banality evil	0
24	never forget said proof forgotten	1
25	enemy within linda sarsour ocasiocortez rashida tlaib ilhan omar	0
26	sandwich maker slow today	1
27	glad youre home russian pooped hallway	0
28	edition dont buy property steal	0
29	justin come chevy faggot mad	1
30	would rather gay son thug son	1
31	make meme using different language everyone still understand e mucho pero e trabajo honesto	0
32	silence female retard	1
33	start nazi party wage war culture	0
34	wife come home early valve cover dishwasher still rinse	0
35	chinese ppl like happy thanksgiving	0
36	two gender male female	1
37	incest never go wrong	1
38	white people shooting range	0
39	hello brother wait shotgun	0
40	partial art	0
41	want play day	0
42	shopping boring fun walmart parking lot	0
43	kill killer number killer world remains batman lol okay faggot punisher	1
44	want yell maga punch jussie smollet	0
45	girl asks mom black youre white say way party went youre lucky dont bark	1
46	need job democrat party hiring experience intelligence required	0
47	im saying muslim muslim	0
48	black neighbor called cop	1
49	call pool full handicap people vegetable soup	1
50	section devide rule religionbased riot crime trust upon hindu even though hindu get killed hand minority taken guilty	1
51	holding cooking class disability give new form independence	0
52	dont think understands gravity situation	0
53	who knock knock bitch obviously	1
54	washington cornwallis laguardia	0
55	yet	0
56	raise destroy flag really people want	0
57	shut fuck feminist angry tomboyish lesbian	0
58	blind people happy see new emojis	1
59	run forrest run	0
60	catch goat running farm ya done fucked	0
61	proving grown adult bully	0
62	today news peaceful terrorist blowing shit	0
63	love boneless jungle ham	0
64	finally headshot black people	1
65	hair half half	0
66	look bright side half black	1
67	kick islam america cant walk god holding hand devil	1
68	tell get ready go youre going walmart	0
69	havent robbed week	1
70	virgin ready get fucked	1
71	believe like racism shouldnt exist	1
72	made rice krispies way kellogs	1
73	sure youre funny stupid	0
74	islam religion peace dont believe blow	1
75	look give got fix kid	1
76	survives ebola thankful see another day	0
77	bos call day oh fuck youre gon na make come	0
78	would kid think mixed punk rap	0
79	careful pedestrian	0
80	jesus take wheel carlos take stereo ill take lookout	1
81	one sold item holiday season	0
82	attack one muslim attacking muslim attack one american attacking american	0
83	transgendered year old like vegan cat know making lifestyle choice	1
84	time meet king arthur round table	0
85	say dirty infidel say filthy goy make become cucks ill mow truck side side white genocide	1
86	cant wait name almost month	0
87	beauty shot girlfriend focusing different thought idea	0
88	trump walmart selling american made appliance	1
89	buckle sugar tit cause im take pound town fuck truck	0
90	im fucking gay cant even think straight	0
91	rose red violet fuck count potatoe firetruck	0
92	best thing ethiopian blowjob know shes gon na swallow	1
93	youre proud white radio station	0
94	offends ban agree	0
95	inbreeding dangerous wrong stand living proof	1
96	find girl like doesnt like dank meme got fucked bet wipe back front thot foolish hoe hope die	0
97	call man paid bride price marry	0
98	father mother like boxer	0
99	perfect bag doesnt exi	0
100	jamal im pregnant	1
101	shut ontario	0
102	fuck final thought making decision	0
103	wheres water	0
104	soon free	0
105	knock knock who parent open damn door	0
106	tweekers like yall hear shit	0
107	group baboon called congress suddenly make sense	0
108	lady amused	0
109	ya partner see unarmed black youth	1
110	doesnt matter good grade high iq lack logic reason common sense youre fucking stupid	0
111	whenever feel stupid remember people throw stone wall aiming invisible devil told invisible god invisible heaven	1
112	kill many want stupid government keep bringing u	1
113	child protective service take away child parent dont vaccinate theyre perfectly fine	1
114	told girlfriend mom deaf speak loud slow told mom girlfriend retarded	1
115	anything doesnt belong black people	1
116	favorite sex position challenger go hard second prematurley blow	0
117	dont always sweaty ball theyre wetter tiajuana hooker spring break smell like zombie vagina	0
118	destroy world kill lot people know history learn	0
119	im long strong get goat hump	0
120	youre happy n family	0
121	coined new phrase muslim terrorist proxy jew	1
122	dick good made pussy retarded	1
123	palestine human being dont deserve live nothing animal	1
124	michelle jealous didnt get yummy hog dog eat	0
125	slipped fell black ice thought regular ice got wallet gone	1
126	kill jew muslim antiwhite	1
127	yes ordered justice department prosecute hillary clinton donald trump frame going	0
128	uncivilized typical nigger	1
129	gas bill high	0
130	every time im public there many people earth need new plague	0
131	clint eastwood michelle obama	0
132	like people forgot area started wanting look like year old	0
133	rare picture beautiful jewish girl anne frank	0
134	call black guy tree briefcase branch manager	0
135	often eat vegetablesbu	0
136	muslim terrorist spy anti semite poster child left	0
137	obama working legalize medical cannabis usa	0
138	younglings cornered room fun begin	0
139	kid never know awful feeling realizing there vhs tape behind box video store	0
140	hate see black neighborhood still offer neighbor candle	1
141	try catch dark type pokemon	1
142	yo dude passed aux cord	0
143	happy kid	0
144	somewhere galaxy far far away someone say nword	0
145	dropping blessing year like	0
146	talking shit trump since day one cry like bitch getting called	0
147	adhd well know place send youll learn concentrate	1
148	show intolerance others religion expect highest level tolerance	1
149	kill american remind islam peaceful	1
150	either work im screwed	0
151	white kid kid dreaming first day school	1
152	kill messenger cant kill message	0
153	forget forget	0
154	swear harvey chasing fly last year	0
155	derek chauvin need protection definitely get attacked	0
156	good ekse	0
157	trying part	0
158	grabbed booty like yahhhhhh	0
159	guess whose house wasnt raided fbi	0
160	donald trump proving dont poor white trash	1
161	seriously mate whats fuckin point	0
162	know pulled scored low asvab	0
163	indian man marries scratch dot wife forehead see he gas station motel subway restaurant	1
164	could u keep escaping	0
165	third person tag list owes nigger	1
166	said woman cant park	1
167	face make youve left plantation longer think like	1
168	way boil vegetable	0
169	sacred cross sound like bullshit let call friend who expert bullshit fairy tale	0
170	ancestor july dummy today july	0
171	happy president day mr president	0
172	democrat difficult time connecting voter smart know much sen mazie hirono hi	0
173	turn	0
174	new boy firend	0
175	thats black people expect	1
176	dont let group get down	0
177	white men look theyve already called cop	1
178	step lego front porch	0
179	equality work place finest	0
180	time youll see muslim hugging pig	1
181	fuck puto	0
182	old as honky porch monkey look woman step johnny law	1
183	porn video feature tranny turn midget curiosity attention	1
184	kill many want stupid government keep bringing u	0
185	immigrant wave flag invader wave	0
186	trained hate man ball stand	1
187	back murderer fight justice	0
188	dope man tell youre onna earn front poop	0
189	pick jewish chick	1
190	wife secretly dinosaur dont find givs birth four crossbreed raptor	0
191	new swing set installed linkin park	1
192	kkk ever let black men	0
193	school shooter finally leaf hottest girl class laying dead floor free real estate	1
194	contries porkistan	1
195	youre fuhrking back say ill pay gas bill daddy	1
196	finally get go outside barn winter	0
197	ugly mafuckas like bru know want got dread	0
198	making mashed potato	1
199	stay step loser	0
200	knight say nigger	1
201	fire cracker	0
202	isnt drain working probably cause pipe black	1
203	fall face first mud	0
204	going paint bathroom door girlfriend dead	0
205	shit dishwasher broken	0
206	breaking news zoo chimpanzee escaped containment	0
207	shut meathead	0
208	sea monkey	0
209	see	0
210	im going home im russian	0
211	last nativity play son invited take part	1
212	lebanon muslim muslim dont worry islam take therell golden age apparently	1
213	wear silk panty cotton one remind slavery	0
214	homosexual get beheaded men cover	1
215	brim hat flat sticker automatically assume youre complete tool	0
216	car pileup mexico today people died	1
217	didnt choose tranny life tranny life choose	1
218	ah young blow quickly	0
219	oh cute guinea pig	0
220	fucking hate dog shagging islamist cunt	1
221	im arrested im trouble	0
222	happy shot face day	0
223	muslim towel head run toilet paper something wipe as	1
224	got bitch call	0
225	feisch smeil	0
226	see goat another man	1
227	fbi raid house catch nutting petabyte child porn wonderful weather	0
228	may blind least im rich	0
229	dont want get attached anyone anymore destroys end	0
230	squatted truck sucking dick getting buttfucked isnt gay enough	1
231	youre rapist youre rapist mexican rapist	1
232	old lady show arthur used war	0
233	look give dressed	0
234	love love	0
235	cameraman dont understan psychic kid trust really funny someday	1
236	boy	0
237	mad yeah youre mad	0
238	anything happens woman blame thats right fault definitely	1
239	uber driver arrives youre probably safer driving drunk	0
240	start second guessing started fight	0
241	went full goat fucker never go full goat fucker	0
242	dark humor	1
243	chocolate good job dosent make child smile	0
244	hope fun investigating turn	0
245	flower martin luther king day	0
246	adding coolant farm equipment overheats	1
247	didnt happen action one man happened people job	0
248	really mein kampfert zone	0
249	raising goat hard work	0
250	anyone seen gary gary tall	0
251	belong	0
252	white people many pet allowed people anymore	1
253	black people started wearing pant low white people called saggin spell saggin backwards sneaky white people	1
254	respect woman dont believe bush meme	1
255	letter mental disorder	1
256	realized life turned better checkmate bitch	0
257	military finally captured massive orangutan	1
258	letter mental disorder	1
259	usher something common got burned	0
260	chinese people like happy thanksgiving	1
261	enough thought prayer please send bob vagine	1
262	people make fun clown coward	0
263	take advantage un foreign aidfunded housing benefit death west	1
264	call double stacked oven jewish bunk bed	1
265	photo shooting day office	0
266	kill many want goverment put jail	0
267	society think v woman economy collapse	1
268	tryna islamaphobic dude backpack lil bulky	1
269	man year	0
270	say white folk dont know cook	0
271	mark zuckerberg marries asian else capable counting money	1
272	meet gender study student gender doubled since last time met	0
273	men gun sent arrest year old roger stone clinton obama sent rescue men benghazi	0
274	mom dress picture day	0
275	biggest piece shit london	0
276	god love child	0
277	whats difference boy scout jew boy scout come back camp	1
278	black men think killing like killing soldier army	0
279	stop domestic abuse	0
280	israel must destroyed scumbag piece dogshit daughter syphilitic pig destroyed	1
281	imagine group people disgusting make law making illegal hate	0
282	see mean furfags welcome	1
283	apparently british public cant put finger problem	0
284	fight country keep land made home	0
285	like sandwich maker double ironing board	1
286	medium call refugee get	0
287	donald trump making supporter laugh rally	0
288	wheres bird box everyones taking	0
289	best gamer ever million kill death	0
290	hi im electrician im remove short check box	0
291	hungry people eat food mmmm delicious	0
292	dude like im going like pic except one man	0
293	hide seek european champion	0
294	meanwhile isi strip club	0
295	day either pro america commie call liberal progressive socialist youre really nothing commie pinko john wayne never military	0
296	mexican rapist im lovin happy hump day bitch	1
297	vw owner like hmmmust tdi meet	0
298	ex say wont find btch half woman	1
299	felt cute might go sit pee idk	0
300	think cute idea maternity picture	0
301	whats really crazy illegal minor drink minor taking hormone surgery change appearance opposite gender nobody care gender reassignment paid tax money insurance premium	0
302	youre one ugly motherfucker	0
303	see god see	0
304	winter discontent day made glorious summer hump	0
305	rise planet ape	1
306	yes im trying divide country im dividing illegals actual citizen	0
307	meanwhile isi strip club	0
308	million year evolution lost hair	1
309	black friday sale	0
310	pussy getting hard	1
311	say he going destroy isi scared speak chicago	0
312	wait mohammad come back didnt mean laughreally size doesht matter lol	1
313	ever notice christian bad driver	1
314	hate snow cold	0
315	eating grandma taste horse cum think oh thats died	0
316	asked permissible smoke marijuana muslim country told contries gay get stoned	1
317	whats difference illegal immigrant et et learned speak english wanted go home	1
318	youll see pic similar close eye	1
319	knew snake let	0
320	thanksgiving china	0
321	kill many want stupid government keep bringing u	1
322	admins like group	0
323	hit blunt dog food lid spelled backwards dildo god	0
324	bought first slow cooker	1
325	cant decide pre heat oven throw meal right away	1
326	six month ago couldnt spell kongris lare one	0
327	nahir nahir born germany nahir german fluffy fluffy born horse stable fluffy horse	1
328	mom asks jew went	0
329	youre racist wont even hire white guy commit fake white hate crime	1
330	million year evolution lost hair	0
331	know like son cant pull girl hair shes actually come around one	0
332	acceptance individuality disgusting thing	0
333	thats nice turkey sandwich haam	0
334	president resident	0
335	irony meter exploded	0
336	transgender take pregnancy test	1
337	weve ever seen worst case suicide hear black guy shot time	1
338	people truly love based personality asian look	1
339	whats worst part black jewish sit back gas chamber thats reich	1
340	talk good moral day night get boner looking goat as	1
341	north american pavement ape	1
342	banned life twitter criticizing movie used twitter promote hoax hate crime risking entire race war still twitter	0
343	thats enough facebook today sammich isnt going make	0
344	pope say trump christian christian dont build wall vatican wall foot high	0
345	motorcross bike ridden drug dealer gang member easily elude law enforcement mother death sport child interest motorcross may joined gang involved illegal drug trade	0
346	mess mess whole trailer park	0
347	dont like sandwich oh well nevermind	0
348	whats black top white bottom rape	1
349	baltimore infested rat live	0
350	hey barack tranny better	1
351	bald eagle represents strength freedom america	0
352	new boy firend	0
353	like men even gay girl buttholes know	1
354	cant kill terrorist theyre relative	1
355	im drink whiskey kill terrorist brother im whiskey	0
356	wife percent legal sharia law fact coming city near	1
357	say islam violent kill	1
358	everyone jew world hate u	1
359	way home hard week	0
360	yes sir thats cock	0
361	youre girl gang bang	1
362	cornbread hell	0
363	bow black woman black praise well know	1
364	blood donated could someone boner right	0
365	see fuckin told little foil top keep jewsy	0
366	muslim	0
367	hate word homophobia phobia would scared faggot	1
368	hear flute drum sash	0
369	hardest part breaking dont want lose	0
370	trying tell giving shit liberal friend men much love trash appreciate	1
371	stupid breed	0
372	hey mom goat asshole inside	1
373	execute plan accept actual born sex youll happier	1
374	make best	0
375	drive cautiously road life folk turn signal	0
376	ready serve first term	0
377	told clean weapon washed hand	0
378	dont stir nesquick powder milk enough	1
379	hold say like hung black men take back place start tying noose	1
380	promise trump going arrested get arrested day confirmed trump isnt going arrested	0
381	obama trump pewdiepies wedding	0
382	last summer hot	0
383	cast view heading protest trump	0
384	see american troop coming way	0
385	oh talk tough behind keyboard tell badass	0
386	birthday good need cowbell	0
387	fuckin slave	1
388	trump cant swing	0
389	date asian boy trynna get family accept	1
390	blm stand black life matter	0
391	happens stay sun long	0
392	see public looking hot mess know bill paid child food aint trying impress	0
393	escaping find better life invading u destroy	0
394	dumped cross eyed chick thought seeing someone else	0
395	want beause love need mix breed preserve specie	0
396	white kid like im killing everybody watch	1
397	didnt buy colour tv watch nagger	1
398	burning great public service	1
399	wiener pit kind like mom	0
400	went gay clubbing friend turn expecting something different	0
401	remember illegal alien wanted go home want free food healthcare housing	1
402	dont jew eat pussy close gas chamber	1
403	last one rotten fish	0
404	feel mentally unwell seek help	0
405	dont ever let man	0
406	lock door every jew gas chamber	1
407	im racist	0
408	lesbian sex	0
409	adhd well know place send youll learn concentrate	0
410	short histoy u president	1
411	dark humor like food everyone get	1
412	would racist black people could read	1
413	illegal alien immigrant	0
414	day realized didnt need bitch bust nut	0
415	people arent friend theyre scared enemy	0
416	sex selfies	0
417	putting bow pet	1
418	one could ever predicted	0
419	hitler would fan current immigration situation	0
420	muslim threesome	0
421	black people smell bad blind people hate	1
422	look give husband would rather fuck goat	0
423	youre wrong neighborhood motherfucker	0
424	people say explosive personality	0
425	mom take picture everywhere	0
426	one time camp someone much gas	1
427	someone tell woman must serve men	0
428	pull yell come got redneck sht getting	0
429	youre conjoined twin often thought	0
430	work hard provide cocaine addiction	0
431	male trapped female body born	0
432	one boy say he fan conor mcgregor	0
433	happy birthday made drink	0
434	best game time farming simulator	1
435	officer	0
436	im racist shadow black	1
437	cat pot	0
438	realize left stove home	0
439	day tom enough jerry shit	0
440	used much thyme doctor showed fix paradox created	0
441	new muslim girlfriend much look	1
442	dream thats belt	1
443	get compliment blue try bashful	0
444	chevy guy go muddin ford guy go muddin	0
445	air hostess give two extra slice bread pack milk still blow plane anyway musalman	1
446	remeber behind great black man police	1
447	bribing muslim liberal vote justin trudeaus skill justin trudeau love foreigner much openly disrespecting canadian canadian value history tradition senior veteran sharia law place canada never never	0
448	youre real life super spy	0
449	month get wk government generation get loan repaid full government	1
450	man bun dont look like samurai look like soccer mom	0
451	youve finally enough autistic brother decide sell local pedophile	1
452	rashida tlaib traditional palestinian garb	1
453	telling american gypsy white trash	1
454	muslim islam religion world largest death cult christian girl killed refusing convert islam islam	1
455	culture great food	0
456	celebreated january know reduce fraction	0
457	hold black baby ear hear police siren	1
458	go black eye	1
459	see muslim muslim see u	0
460	trans woman woman trans woman woman trans woman woman trans woman woman still got ta get prostate exam tho	1
461	husband always pushing around talking behind back	1
462	let perfectly clear never stop lying sucker	0
463	white friend invite dinner tell bring whatever want	0
464	rice cooker versus	0
465	england moslem rape child reporting crime	1
466	fuck multiculturalism white baby	1
467	shit right suicide people	0
468	go black dont go back	1
469	mean chair dont see sitting	0
470	hello abdul today im alone home abdul ultimate	1
471	go around launching lawsuit let remind surveillance photo remember tranny crack whore line dick	1
472	see greatest band live concert see laptop live	0
473	alright im going let go	0
474	sandwichmaker slow today	0
475	idea black going	1
476	black black	1
477	put sunblock doesnt protect harmful ray	0
478	cheering team world cup	0
479	horror holocaust three u soldier look body stuffed oven crematorium	0
480	really mean say going bathroom	0
481	buslim nibba see sister	1
482	ancestrycom tell im german rev fryer	1
483	running tired bitch dick give clamp bitch	0
484	marry pubg player	0
485	kill many want stupid government keep bringing u	1
486	thats way allah allah like	1
487	time selfie day	0
488	goy hate subversive parasite double standard anti semits	1
489	meanwhile isi strip club	0
491	dont pooper	0
492	laughter really best medicine	0
493	america stolen jew jew god jewelry negro true hebrew google	1
494	fifty shade goat isi love story	0
495	cant spend money education instead drug	0
496	bruhh white ppl give headache	1
497	smile creeping need tell smile creeping	0
498	dont shoot im unarmed	0
499	motor neurone award winner best trex impression	1
500	can not invade trailer park dumpsterdefend yeet cannon behind every door	0
501	remember kid hot car keep road beer	0
502	face make ahmed hit gspot	1
503	teacher roast homie doesnt know bomb thats going min	0
504	havin road problem feel bad son got problem ditch aint one	0
505	here shooter garlic festival el paso dayton eerily similar look awake yet	0
506	black boy friend	0
507	there even one homeless child america room illegal alien	0
508	nazi toxic hate culture	0
509	let pursue happiness	0
510	gravity never heard	0
511	goat raw muslim trying fuck	1
512	name multiculturalism let terrorist country	1
513	survey gay straight lidentify tired im tired	0
514	fuck puto	0
515	orgasm shoot tranny fluid	1
516	catch goat another man	0
517	surprised see	0
518	invented internet medium widespread theatrical selfaffirming expression moral superiority	0
519	shouted lock arent shouting lock might hypocrite	0
520	mexico first america last	0
522	gon na jump im holdin back	0
523	know youre lying continue	0
524	thats bomb	0
525	honor killing part culture well honor kill	0
526	putting fridge look every time go get snack dont need could easily lost tirty pound ti munt	0
527	wear silk panty cotton one remind slavery	1
528	three type girl	0
529	wing wing wing herro thats racist	1
530	dog love attention	0
531	look father sell goat	0
532	running school	0
533	oi looking	0
534	fifth pet eats food another guy hand	0
535	well kill trivial shit fucking mock dying word	1
536	white person tell happy cinco de mayo know deep heart want deported f u c k e r	1
537	love old truck think everyone one	0
538	white trash go hell trump fuck donald trump	1
539	may smart man ilhan know jewhating islamist sound like	1
540	hope change built	0
541	told cant tolerate person agrees	0
542	day grade sandy hook elementary school	1
543	get mad film portraying muslim murderous savage responds murdering savage	1
544	handjobs sold seperately	0
545	earth endangered specie white child	0
546	there much white trash picture barely know start	1
547	got arrested punching guy new year party hear arab counting ten instinct kick	1
548	whats worse female driver	1
549	socialism people line waiting bread capitalism bread lined waiting people see difference	0
550	dream one day people act like animal	0
551	coffee isnt helping get jumper cable	0
552	fuckin bastard win going hang g noose better fix shit hillary clinton email donna brazile october	0
553	know youre getting older walk priest dont even get look	0
554	need problem solver racist religious bigot office	0
555	death muslim	1
556	slipped hit bathtub everyone asking thing okay home	0
557	meanwhile isi strip club	0
558	indian go walk dog	0
559	bad day could siamese twin attached gay brother date youre one as	1
560	get black guy see baby	0
561	im racist drug dealer black	1
562	preadtor love love	0
563	group baboon called congress clear	0
564	hate see black neighborhood still offer neighbor candle	0
565	im long strong get goat hump	1
566	started business sell landmines disguised prayer mat prophet going roof	1
567	healthcare muslim	1
568	noise start screaming concert ya girl dj say single lady make	0
569	knowing white people he probably father	1
570	coming america one way another rape pillage reap havoc riot nation stealing welfare	1
571	protestant good usual	0
572	step one turn gas	0
573	converted muslim would think	1
574	face make ahmed hit gspot	1
575	girl squirter sever artery	1
576	congratulation non binary	0
577	muslim goat	0
578	big bird specie mostly scavenger like turkey vulture would attack weakened prey	0
579	attacking person theyre attack people culture whole	0
580	head diaper required shit brain	1
