	text	label
4410	peacful dont believe blow	1
4411	last time im michelle obama	0
4412	serving food local farm cafe	0
4413	never forget harambe died teach u importance strong border	0
4414	adam eve native american try apple tasty	1
4415	chevy guy like got done muddin ford guy like got done muddin	0
4416	movie night	0
4417	stupid bitch race	0
4418	popular least talked white trash barbie kid b like fault didnt pay cable	1
4419	accidentally send dk pic mother	0
4420	omg middle east ninja	1
4421	dont see color race make sure surround diverse group people	0
4422	stop saying terrorist muslim terrorist	0
4423	sicced corrupt goon year came clean turn send justiceseeking patriot corrupt goon let see come	0
4424	rebuilt tranny blew tranny automatic tranny	1
4425	im gettin white girl wasted tonight	0
4426	hmmm wonder get couple muslim sex slave	1
4427	kid thought black people made anal sex	1
4428	he muslim asks role play	1
4429	house pedophile	0
4430	came	0
4431	racist vote donald	0
4432	u like pray protest u get poppin crakkka	1
4433	fresh bradford bomb jovi	1
4434	argue black person online im gon na whats called progamer move	1
4435	youre telling cant pick bedtime pick gender	0
4436	consume much trans fat	1
4437	found wife cheating ya allah	0
4438	need hug love hug	0
4439	spring cleaning time rather sleep	0
4440	something went terribly wrong	0
4441	oh boy sure love muslim new zealand city christchurch march	1
4442	ilhan omar participates house education labor committee markup	0
4443	god created	1
4444	one kind broom keep place clean	0
4445	funny he fat	0
4446	wonder he thinking siri find interracial tranny amputee midget fisting porn	1
4447	shrug knowing eat starting pay	0
4448	terrorism part parcel living big city sadiq khan london mayor tokyo million people islamic terrorism	0
4449	hang sock doorknob roommate know come im busy fucking sock	0
4450	north shovel snow south shovel ash	0
4451	get choose mental illness	0
4452	forget bomb code	0
4453	im racist racism crime crime black people	1
4454	farm equipment livestock dont mix	1
4455	squirt wrong hole	0
4456	start rave ethiopia tape peice toast ceiling	1
4457	winter discontent made glorious summer hump day	0
4458	never forget	0
4459	medium blame violence black people weve forgotten cracker	1
4460	waterin dirt	1
4461	stand still bc there active shooter	0
4462	islam love ariana grande august hillary clinton rally yeah youre goat	1
4463	baby bear get arrested cute	0
4464	police academy graduation ceremony	1
4465	waiting girl oustide house	0
4466	refugee welcome	0
4467	know colored people air freshener car cant stand smell nier either	1
4468	hey muslim eat	1
4469	say woman color want inclusive white woman	1
4470	every man need decent coffee maker	0
4471	thats new skyscraper going come	0
4472	tear next time walk run	0
4473	showing skin since dont anything else offer	0
4474	cracking open cold one boy	0
4475	figured trump conned fucking bright	0
4476	muslim guy walking goat	0
4477	hitler giving speech	0
4478	im gynecologist know cunt see one	0
4479	stop im trying put load dishwasher yeah	1
4480	putn ham mohamed	1
4481	dick game weak finger game world	0
4482	migrant caravan arrives	0
4483	finally buy dishwasher work lot better sponge	0
4484	hate american hillary obama trust	0
4485	forgo history embrace slavemaster	1
4486	respict wish dictionary	0
4487	meanwhile isi strip club	0
4488	shouldnt study civics high school study car	0
4489	america like never forget get	0
4490	bill bill supply guest beverage bill make sure place sleep bill gracious host like bill	0
4491	genuine dumbass mexican	1
4492	granny tranny clintonobama democrat secret weapon	1
4493	sex goat wipe ass hand drink camel piss im unclean one	0
4494	go back country fled somalia camel piss drinking mussy	1
4495	dont fuck act youre around	0
4496	im relaxed minding business	0
4497	nobody gordon ramsay need revive hitler teach use fucking oven	1
4498	woman believed one bitch accuses democrat	1
4499	group men	1
4500	bruder killed jew could control medium jew could control bank jew control money jew could control government child could die israel foreigner could destroy city foreigner could run civil public service become prisoner home people race lost forever	1
4501	dont think abortion wrong raped wouldnt wont black baby either	1
4502	need diaper youre still baby	0
4503	never drinking fucker ever	0
4504	girl like hate guy stare gym	0
4505	yo mama dumb lost rigged election	0
4506	mom asks jew went	1
4507	big black as choice	0
4508	today news peaceful muslim blowing shit	1
4509	husband always pushing around talking behind back	0
4510	imagine entire country ignorant people wilfully give billion dollar order elect rich criminal rule life steal money believe free	0
4511	picture remember fun night	0
4512	smile even worst time	0
4513	difference	1
4514	celebrating weekend like	0
4515	stevie wonder like selfie	0
4516	woman recieve support crop burn	0
4517	dont always post offensive meme like champ	0
4518	rape youre democrat	0
4519	wife asked thought friend pretty apparently id lick asshole wrong answer	0
4520	trump muslim wear special id badge great idea	1
4521	feel one night drinking	0
4522	hey look im serial pedofile	0
4523	diverse group woman	0
4524	dont like admit mustache hide mole	0
4525	beach vibe	0
4526	open ice cream shop sell shake	0
4527	white trash marriage material	0
4528	real racist democrat without slave pick crop democrat without illegals pick crop	1
4529	woman supposed like butterfly beautiful look hard catch yall acting like bunch mosquito	1
4530	shoot guy	0
4531	wear silk panty cotton one remind slavery	1
4532	youve finished life crime	0
4533	thinking im thinking	0
4534	rise planet ape	0
4535	terrorist come country way easy	1
4536	hundred gathered volkswagen owner meet according nasa glow check engine light could seen space	0
4537	german grandfather teach make gingerbread house	1
4538	black men latin men asian men white men	0
4539	dare people make fun peaceful religion	0
4540	swear put sunscreen	0
4541	dat as ahmarbkrichd	0
4542	want whore buy one want queen earn want nickel bag fifteen buck little man	0
4543	thats little savage	1
4544	spongebob patrick look like theyre rough day	0
4545	see goat another man	0
4546	found wife cheating ya allah	0
4547	become besties dude	0
4548	definition utter disgust plain black white	0
4549	alabama ban abortion alabama year	0
4550	started company selling landmines look like prayer mat prophet going roof	0
4551	dont care liberal pro lgbt government officals say see man follow female family bathroom hell crawl looking like	1
4552	can not arm teacher violates right shooter	0
4553	type fidget spinner autocorrects midget spinner	1
4554	refuse doggy style doesnt want puppy	0
4555	someone somewhere america today last day ten finger	0
4556	robert mugabe better man stingy money hustled woman deny hole didnt even drill	1
4557	asian eye like isnt hard see	1
4558	oh look men	0
4559	youre heaven got virgin allah lied one goat	1
4560	build house stone	0
4561	found mexican baby come like food	1
4562	wave mexican flag doesnt want live mexico	0
4563	mexican feel trump wall theyll get	1
4564	fought iraq war died started iraq war lie made billion profit	0
4565	teacher dont make explosive inside lab le mohammed	1
4566	happy birthday keep classyno wine box	0
4567	racist mean dont want country turned pile rock goatshit ruled barbric cult im racist	0
4568	trump donated salary alcoholism research see personal attack	0
4569	look like ultimately obama behind entire plot undermine trump presidency forget russian real enemy	0
4570	hardcore way eat ramen noodle boil water eat block ramen drink boiled water snort flavored powder fuck bitch	0
4571	fresh prince	0
4572	shes pouting like dont immediately drop argument motherfucker gay	1
4573	life ups down	1
4574	got bootleg copy muslim porn deep goat	1
4575	kylie pregnant im gon na tranpa	1
4576	time talk bird bee	0
4577	sad life must put hope dream man	0
4578	idea black going	0
4579	go ancestrycom instead matchcom	0
4580	one simply walk north korea	0
4581	forget wash hand	0
4582	thankfully youtube blocked video show support muslim people	0
4583	stupid neighbour woke	0
4584	beat usa immigration sytem marrying brother even got job congress american stupid	0
4585	new military drone fight isi explodes penatration	0
4586	youre losing argument black friend	1
4587	setting economic miracle next president	0
4588	life must difficult much respect	0
4589	as say dont suck dick wayment	0
4590	dad dishwasher sandwichmaker fritz	0
4591	take politically oust constitution establish sharia law behead non muslim right street america	1
4592	cheap shoe sale pick christchurch mosque	1
4593	rebuild	0
4594	vote free kfc grape kool aid watermelon	0
4595	life goal make somebody fucking triggered	0
4596	appears youre hm cracker	0
4597	black man created toilet made white purpose	1
4598	country traitor killed america join democrat party	0
4599	brother suck driving	0
4600	would love excited woman soccer team victory guy ruined	0
4601	vent white person ughh mom pissed wan na kill u go wit dat b	1
4602	gay aid really like	1
4603	heard term nonbinary wtf tolerant learn new fkn language learn new fkn language	1
4604	mom plastic youre spastic tragedy	1
4605	okay honeywe stole could well live way better fool voted u	0
4606	love pancake	0
4607	youre telling ingrained white trash dna facial hair actually grows white trashy like	1
4608	time make peace islam	0
4609	doesnt wear tampon trip string	0
4610	dont understand shot didnt run police	0
4611	meanwhile isi strip club	0
4612	somebody say hump day	0
4613	different type station	0
4614	cooking teacher today well learn use oven german kid	1
4615	weed hit hard	0
4616	smell reich cooking	1
4617	want fuck goat year old wife say unatural	0
4618	abilty stronger disability	0
4619	see innocent child see perpetuation systematig oppression	0
4620	told youre going fun camping trip	1
4621	tell let figure	0
4622	muslim kill people day nobody bat eye one man drive muslim everyone loses mind	1
4623	youve already explained mad time still dont get let fight	0
4624	step landmine weigh enough	1
4625	call pool full handicap people vegetable soup	1
4627	youre struggling bad date rub one	0
4628	damn really thinking making class	0
4629	thor throw hammer serving justice throw hammer anger management issue	0
4630	boy killing innocent people bomb blast	1
4631	oh look new wife arrived	1
4632	shoot	0
4633	brother girlfriend money lose dont progress life find one girlfriend invest build future together	0
4634	two common good sucking come bag	1
4635	dishwasher broken take back walmart get new one	0
4636	ford owner blew rod wasnt talking engine	0
4637	waiting	0
4638	someone start acting friendly already know really	0
4639	friend come go brother last forever	0
4640	uncle daddy gon na u nephson	0
4641	fucked plan get weekend	0
4642	middle eastern prostitute	0
4643	man dress like doubt he gay	1
4644	whatever auburn fan	0
4645	start fingering sister cum instead	0
4646	im starting understand appeal demand sex robot	0
4647	planet ape scifi classic	0
4648	rep ilhan omar people something here something people dead terrorism	0
4649	dude want use restroom daughter liberal call bigot object	1
4650	democrat investigate trump year thing uncover crime	0
4651	would racist black people could read	1
4652	fly plane building kiss ass	1
4653	domestic violence level chicken coldbitch	1
4654	id hit shit harder brother hit world trade center	1
4655	help starving child world	0
4656	im saying im racist im saying muslim terrorist	1
4657	either die hero live long enough become villain	0
4658	white people put divider grocery	0
4659	hell wrong america voting towel head congress	1
4660	look wan na cut bitch youre better person	0
4661	kind people may worship odin except gay jew transgender sex worker arab asian non white hispanic nigger	1
4662	never assassinated crazy white trash people gun biggest fan	1
4663	woman allowed join army	0
4664	gave leg	0
4665	muslim celebrate new year	1
4666	ewe stop	0
4667	say	0
4668	active shooter walmart tx targeting hispanic armed white people	1
4669	dad best hide seek he gone year	1
4670	get choose mental illness	1
4671	good thing come wait	0
4672	president trump keeping bitter old lesbian hag white house since	1
4673	lunch vlad impaler loved turkey	0
4674	oh shit trouble	0
4675	turn dishwasher snow remover	0
4676	dont want talk dont post vague status update fishing people ask whats wrong	0
4677	flavor dish nonexistent customer started religion believe	0
4678	little car bomber brings home first girlfriend	0
4679	maybe think act youd treated better	0
4680	hiding need see tax return let stop right hillary deleted email used bleach bit hard drive destroyed phone hammer right talk people hiding anything truth uncensored	0
4681	open ice cream shop sell shake	1
4682	say right bang goat	0
4683	get nothing loose good day sir	0
4684	million kill death fucking camper	0
4685	muslim claim noah muslim noah brought pig boat happy sinday	1
4686	god chosen people according book wrote	1
4687	squad get lit	1
4688	youre shooting school autistic kid take glock join werent expecting special force	1
4689	wendy williams transvestigation drag queen	1
4690	much butthurt sense	0
4691	month born went party dad left mom	0
4692	almost terrorism sponsored saudi arabia solution terrorism problem solved	1
4693	neighbour ordered blowup doll muslim sex shop	0
4694	time make money old fashioned way killing christian	1
4695	someone think okay fuck bc think youre love light stab u neck susan	0
4696	hey met crazy mad face might angry	0
4697	make lady junk tingle	0
4698	im trying put load dishwasher let help	0
4699	hear em yelling allahakbar crap shoot em blow bomb start stabbin shootin people	1
4700	dude walk lady bathroom one girl quickly identify mma fighter	0
4701	turn light realize fisting wrong hole	0
4702	dark humor like never get old	1
4703	farm equipment livestock dont mix	1
4704	eat rehab romance booty laundry room shes day sick	0
4705	thats right canada used tax dollar purchase pipeline would never get built destruction canada plan ask bos could imagine well done canadian stupid	1
4706	eix didnt sign shit	0
4707	strong survive	0
4708	racist best slave black	0
4709	thinking lunch clocking	0
4710	enemy within ilhan omar linda sarsour rashida tlaib ocastocortez	0
4711	fish raw still trying find nemo	0
4712	never forget	0
4713	q hey filipina ever marry filipino nah ugly filipino seed rich white daddy please	1
4714	classic photo anne frank	0
4715	kid remember	1
4716	elect enemy rule stupid american	1
4717	keep genetics	0
4718	want stop faggot	1
4719	sheik business man wearing tradition thawb	0
4720	deportation bus arrived	1
4721	grow im going blow	0
4722	gay friend asked direction told go straight	1
4723	he attractive kinky shame much potential	0
4724	bad black jew sit back oven	1
4725	america american period agree dont go back europe	1
4726	think gang member human old fetus arent might democrat	0
4727	u tryin cute got ta make everything sexual	0
4728	barn army enlist bomb ant hill grab pitchfork meet barn	1
4729	muhammad go dry	1
4730	black people mitochondrion powerhouse cell	1
4731	scientist working hard cure	1
4732	dont stir nesquick powder milk enough	0
4733	like baby keep baby dnc campaign slogan	0
4734	last nativity play son invited take part	0
4735	black girl green contact bitch stop look beautiful naturally	0
4736	people walk mile day fresh water kid never know struggle	0
4737	joe mistake curious george obama youll bigger one creepy joe	1
4738	cameraman dont understan psychic kid trust really funny someday	0
4739	google glass locate kfc	1
4740	face make schoolmate shot dead youre go tv	1
4741	fridge full dont know eat	0
4742	ever wonder asian make fun caucasian look peripherar vision speak engrish	1
4743	every modern rap album cover	0
4744	marge converted islam	1
4745	know grind gear nigger	1
4746	im sorry made chewbacca sound maybe shaved next time	0
4747	respect elder theyve learned lot time	0
4748	show american ghetto ill show place democrat power	0
4749	dont believe god youre going suffer burn eternity hell child abuse isnt necessarily physical	1
4750	dont want affordable health care demand tax cut billionaire	0
4751	little boy get new hand man loses hand	0
4752	fuck islam	1
4753	meanwhile isi strip club	0
4754	isnt interesting isi run money obama longer office	0
4755	one piece shit wont flush	0
4756	rose red grass green pls show bob vagene	0
4757	unnecessary lifevest ice cube float	0
4758	get loser invading poland	0
4759	authentic lunch venezuela	0
4760	dont get sunburnt use sunscreen	0
4761	way end racism kill racist oprah winfrey yeahshe mean white people	1
4762	traveling chimney	1
4763	remember behind every one u police	1
4764	im dreaming white christmas	0
4765	good asian	0
4766	youre really drunk speaking fluent ozzy osbourne	0
4767	guy think dog autism lmao	1
4768	fight believe fight future	0
4769	hello brother wait shotgun	0
4770	embrace freedom speech	0
4771	mother tell child mock weight	0
4772	someone else used kid push agenda	0
4773	youve long day need geroceries	0
4774	pinyata party emo kid hung improvise adapt overcome	0
4775	said im blackbelt mcmap	0
4776	face make youre bully got beat girl	0
4777	america reality dont let medium divide u	0
4778	fuck goat fuck goat	1
4779	dj osama spin laden droppin beat like twin tower	1
4780	ilhan omar vowed first day congress conduct muesli ritual cleanse chamber right wing evil share say shes evil one	0
4781	shit posting group exist indogs free real estate	0
4782	everyone el butt v butt	0
4783	asked mom go play	0
4784	sex suddenly stopped didnt move hush bitch seen pornhub called buffering	0
4785	new bold hate hate white jew christian conservative republican patriot	1
4786	muslim party	1
4787	whats difference menstrual blood sand cant gargle sand	0
4788	influence election mean like encouraging illegal immigrant vote	0
4789	put muslim killing canadian absolutely tolerate canadian criticizing muslim	1
4790	take long blow candle	0
4791	hurt knee day still gon na go christmas shopping	0
4792	august last word would copilot moment total destruction hiroshima unleash hope rice people like mushroom	1
4793	youre fit know youre still majestic af	0
4794	yes im part indian im smackahoe tribe	0
4795	retarded kid try touching	1
4796	muslim attack prepared fight back	1
4797	normie meme racist offensive im unfollowing nigger take way	1
4798	hey bro close eye bro yes bro ok bro go deeper yeah abdul	1
4799	say folk radical liberal terrorism	0
4800	ramadan begin may bombathon end june	1
4801	putn ham mohamed	0
4802	know like son cant pull girl hair shes actually come around one	0
4803	got problem chromosome	0
4804	muslim figure must porkfree menu leave u help pack	1
4805	celebrating presidential election	0
4806	muhammed get roof	0
4807	youre hard hitter	0
4808	sex selfies usa croatia germany	1
4809	kill many want stupid government keep bringing u	1
4810	security important airport shouldnt important border	0
4811	dishwasher broken take back walmart get new one	1
4812	harder harder thats good boy	0
4813	rohingya woman protest rohingya crisis anniversary	0
4814	fucksake porn hasnt downloaded properly	1
4815	terrorist islam terrorist slam slam car car people	1
4816	got warrant arrest	0
4817	dumb happy	0
4818	jolo jew live	0
4819	breaking rep ilhan broke federal tax law filed tax jointly man legally married	0
4820	hey	0
4821	friend asks want get stoned thought meant	0
4822	israel teach terrorismsir	1
4823	white men biggest terror threat except white boyfriend	1
4824	catnip got mixed turkey	0
4825	get kicked every country blame	0
4826	playing monkey thailand	0
4827	offends ban agree	1
4828	sea monkey	1
4829	grandma couch always covered plastic squirter	0
4830	white people put divider grocery	0
4831	decide go full gas	1
4832	white house dump trump filled trash	0
4833	like democrat hate mueller trump	0
4834	always wag tail try hit everything	0
4835	muslim world gay men well hung	0
4836	dare criticize woman color	0
4837	told black vote	1
4838	look sandwich maker club found wish clearance	0
4839	open liquor live car car home im sure liquor home cop pull house open liquor	0
4840	halloween month ago son continues dress woman	1
4841	celebrating ebt card oh snap	1
4842	president literally	0
4843	may past teach u never let happen	0
4844	post offensive meme winner get day vacation dare win	0
4845	started company selling landmines look like prayer mat prophet going roof	0
4846	muslim seeking equal education	0
4847	nonmember membersonly gate let autistic reaction let iiiiiin	1
4848	man dress celebrate chinese new year pig	0
4849	know really grind gear nigger	1
4850	dont shoot im group dont post comment im shy like stuff	0
4851	feeling cute might eat hay later idk	0
4852	wear number one he likely fastes team	0
4853	im gon na like phelps one day	0
4854	grab nevermind	0
4855	hitler auschwitz like going leave another minute two get nice smokey	1
4856	omw kill israhellites	1
4857	goat hit gspot	0
4858	female muslim rock band	0
4859	rev al sharpton kid black unarmed	0
4860	next time complain hungry remember could worse	0
4861	people gather eid alfitr praying	0
4862	bruce jenner cat	1
4863	oven could burn le body per year metal would fracture tone	0
4864	south african lost life police opened fire protest	0
4865	say cheese photobomb	0
4866	master chef low rating master chef high rating	1
4867	like play game friend favorite game called child soldier	1
4868	gay social medium equality body positivity love love love gay real life place social circle	1
4869	want enter islam want leave islam	0
4870	san francisco ban plastic straw still provide plastic needle junky	0
4871	thirsty much	0
4872	quick need get rus hey donny wtf	0
4873	mark zuckerbergs wife priscilla chan man	0
4874	country made real men cowardly as muslim bitch	1
4875	ancestor look stupid	0
4876	someone else used kid push agenda	0
4877	number side effect steroid acting like douchebag	0
4878	hear u loud clear step every homeless american give illegal alien everything	0
4879	north american pavement ape	0
4880	money money money	1
4881	visit germany germany visit	1
4882	snake mouth look inside think everything clear	1
4883	wife got seashell tattoo inner thigh put ear smell ocean	0
4884	phobia fear something fear fear gay people called homophobia gay people fear	1
4885	upper downer	1
4886	left cant meme left meme	0
4887	kid today v kid	0
4888	mean wasnt german	0
4889	chevy guy like got done muddin ford guy like got done muddin	1
4890	learn good	0
4891	selfie time	0
4892	put purple lipstick became bomb	0
4893	white people learn fish swim school	0
4894	white people know thyself	1
4895	wouldnt stop polar bear	0
4896	morgan freeman morgan notsofreeman	0
4897	hen unvaccinated chi rvives year cides kill chosen one	0
4898	punch muslim kid hard start seizure fucking dy bomb defused	1
4899	holocaust make sad	0
4900	life handed lemon fucked pee hole burn	0
4901	sure timmy ill hold mayo	0
4902	finally headshot black people	1
4903	cow girl like take summer photo hay field	0
4904	youre caught staring goat wife give face	0
4905	muslim muslim congress defund homeland security	0
4906	muslim quran order u immigrate country replace government sharia law order murder christian jew gay people embracing slavery pedophilia thanks democrat making easy u	1
4907	dad wanking give big muscle dont know son dont stop im cum	0
4908	fuck enemy hard eyebrow bleed	0
4909	mr obama honor	0
4910	snooze lose	0
4911	thought hillary clear oh cupcake got surprise	0
4912	obama voter	1
4913	mean dont pick eat	1
4914	cant spell rape without ape	1
4915	sooo gorilla really human	1
4916	man award terrorist million dollar killing american oldierfucking scum bag	0
4917	congratulation boy	0
4918	would pregnant	0
4919	who birthday girl youre birthday girl	0
4920	result war	0
4921	thanksgiving china	1
4922	smashed potato	0
4923	like sandwich maker double ironing board	1
4924	girlfriend tell dry as joke want get end night	0
4925	liquor store ask photo id theyre trying keep people color drinking	0
4926	breakyourownnewscom live breaking news coca cola released ustad anwar rilis released	0
4927	fast sandwich maker	0
4928	go back sleep government control	0
4929	like sandwich maker double ironing board	0
4930	ay man ya	0
4931	jewish prisoner trying escape auchschwitz shower colorized wwii jew escaping hitler rath	0
4932	good skeleton	0
4933	youre introduction first day class teacher make say thing arm like damn rocket cock like burmese python mind fucking scientist	0
4934	finished shooting bunch black kid accidently killed squirrel	1
4935	hello maria yes uber arrived	1
4936	would racist black people could read	1
4937	crime humanity swiftly forgotten	0
4938	lifetime present surviving life	0
4939	last year tyrone got new job started building credit spending time kid something amazing started happen	0
4940	sandwich law sandwich complete without bacon	0
4941	black people arent lazy doesnt kfc breakfast menu	1
4942	bubble fun	0
4943	see gas bill	0
4944	picture great great great grand grandfather tractor dont make like used	0
4945	squad town yall ready go hoe	0
4946	hitler like sure killed million aint	1
4947	five finger meth punch	1
4948	national hebrew day let make challah	0
4949	jolo jew live	1
4950	mental illness lead anxiety depression case selfmutilation andor suicide	0
4951	abnormal v normal	1
4952	said could burger	0
4953	oh god dont give fuck	0
4954	holocaust make sad	1
4955	jussie smollet taken gunpoint maga country	0
4956	youve realised son taken wrong backpack school	0
4957	whats difference first one cant sing put chain	0
4958	jew problem zionist israeli jew	1
4959	illegal immigration cowboy way well know try come back	0
4960	stopped suicidal boy jumping rope	0
4961	men like im finally ready settle	0
4962	give white man back god everything post going offend	1
4963	happy birthday michael j fox	0
4964	look neighbor yard see illegal immigrant mowing lawn	1
