	text	label
3332	dont know deal black people guess ill take shot	0
3333	dishwasher broken take back walmart get new one	0
3334	muslim muslim congress	1
3335	come girl let smell yo butt	0
3336	x know trump supporter stupid	0
3337	smell reigh cooking	0
3338	fucking idiot	0
3339	number supposed go	0
3340	stupid american taking country cant stop u	1
3341	manual tranny automatic tranny rebuilt tranny	0
3342	gay hanging muslim world	1
3343	head diaper required shit brain	1
3344	ill saving resolution think wan na asshole year	0
3345	obama throw first pitch allstar game	0
3346	never take man take lot selfies seriously either he gay thirsty arrogant need attention like female	1
3347	dike started dating tranny god cant mad still relationship man woman	1
3348	cop question black kid raise hand cop jayshaun dont put fucking hand ill shoot like father hand dont shoot	1
3349	whiteman devil	1
3350	destroy patriarchy simple eat	0
3351	original black friday sale	1
3352	youre easily offended looking safe place page aint move along snowflake	0
3353	spring dont forget reverse battery cable air conditioner come instead heat	0
3354	nobody trying take gun want make register restrict transfer ban certain gun limit magazine capacity prohibit carrying ban limit ammo make arbitrary law catch violating madeup rule throw prison point take gun	0
3355	got bitch call	1
3356	explodes penatration new military drone fight isi	1
3357	got house fumigated termite got service connected agent orange	0
3358	stop burning jew start burning calorie	1
3359	please name lord let u pray jackson safety black gay men america get hiv say cdc	1
3360	cake day really wan na blow candle	0
3361	racing pink slip africa	0
3362	smoochies donald birthday	0
3363	get caught jacking snapchat girl filter wasnt patricia	0
3364	dont ex y like hell date	0
3365	iraqi woman ugly wear sheet dude imangine theyre fucking goat	1
3366	girlfriend hot like	1
3367	manditory vaccination exemption nazi problem	0
3368	get loser invading poland	1
3369	slave salesmanslams hand head baby pick much fucking cotton come one color tho	1
3370	see rollin hating	1
3371	smile matter going	0
3372	love muslim point right direction	1
3373	local mosque really going gay pride year	0
3374	feel used belong bruce jenner	1
3375	time hang dirty hooker tranny	1
3376	im love shape jew	0
3377	black people anthing doesnt belong	1
3378	mobile nun	0
3379	must way victimizes	0
3380	little broblem school today solved oh here gun back	0
3381	momma momma say girl devil	0
3382	deport goat fornicator fukislam	1
3383	mean tell much clean water shit	0
3384	im saying perfume strong im saying canary alive got	0
3385	someone call gaming name public	0
3386	influence election mean like encouraging illegal immigrant vote	1
3387	goat raw muslim trying fuck	1
3388	white people asian look also white people	1
3389	speak end domestic violence	0
3390	difference moderate muslim radical muslim moderate muslim follow allah kill radical muslim follow allah kill	1
3391	mean dont pick	1
3392	ask dumb question	0
3393	dishwasher broken take back walmart get new one	0
3394	sent much smoke red indian came make peace	1
3395	man bun tie hair like giving head	0
3396	latino anything get trump america	0
3397	dont need tell fuckin good meme get reported fuckin time	0
3398	dont lonely trump haterscom	0
3399	got flat way store	0
3400	told girl text got home must homeless	0
3401	destroying babri hindu niqqas buslims throwing stone local mandir	1
3402	mariachi make party better	0
3403	whats better winning gold medal contest walking	0
3404	bomb	0
3405	brother day without blast day wasted	1
3406	cop celebrate weed bust	0
3407	mom im pregnant	0
3408	april coming bitch better money memegeneratorne bitch better money	0
3409	teacher ok class bring calculator mohammed	1
3410	dont hear people asked birth certificate asking trump tax return	0
3411	every chocolate girl need beating	1
3412	democrat test result back donald trump daddy	0
3413	thing vile attitude anti american absolute ignorance delusional people voted	0
3414	call goat fucker racist	0
3415	oh he using sex stop bitching sex awesome complain he using laundryor human shield	0
3416	take dishwasher restaurant start talking	1
3417	booty feel taco bell drop	0
3418	okay believe believe okay demand believe way	0
3419	cannibal tribe indonesia take muslim refuge amount	1
3420	listen cupcake losing country goat humpers	1
3421	military funeral saddest	0
3422	muslim porn star	0
3423	finishing race passion	0
3424	talking animal right fun	0
3425	dont see color race make sure surround white people	1
3426	eye always bloodshot sex think pepper spray	0
3427	there much white trash picture barely know start	0
3428	sweet home allahbomber	1
3429	night v next morning	0
3430	make left youll see fucked	0
3431	chased high paying job new york imagine ill rest country	0
3432	cant get pregnant shes goat	1
3433	look son another terror attack peaceful muslim	1
3434	everyone talking protecting minority right need remember smaller minority individual	0
3435	hello satan mocking islam	1
3436	education child smile priceless	0
3437	beautiful family	0
3438	send sexy pic	1
3439	islam radicalize muslim muslim terrorist quran kill non believer till religion islam	1
3440	notice kenyan skidmark silent mueller report	0
3441	told friend turn fruit vegetable told prove pushed balcony	1
3442	nigga wouldve got death penalty	1
3443	im saying slut go everyone	0
3444	race equal	0
3445	yes donald sound good built wall	1
3446	gf fucking black guy break tail light car police stop shoot modern problem require modern solultions	1
3447	dashing grass im coming rape as	0
3448	asian driver test accident	1
3449	old ice cream face gag	0
3450	type fidget spinner autocorrects midget spinner	1
3451	isi glory hole	1
3452	pro gamer kill death	0
3453	call terrorist zmt identify firecracker	0
3454	muslim parent use open wide come airplane technique smash baby face make explosion noise	1
3455	im racist racism crime crime black	1
3456	praise goat fuck arse name mohammed prophet	1
3457	pelosi saying nutshell dont allow unvetted immigrant illegally enter country well take away gun	0
3458	still confused strategy game	0
3459	hillary isnt jail wall isnt built isi hasnt defeated obamacare still place trump gave million tax cut important	0
3460	white people like outside inside	1
3461	overly attached muslim girlfriend killed wife time beat	1
3462	chinese people name baby throw stair see noise make	1
3463	dude im joking grandma didnt use pacifier butt plug	0
3464	holy shit look gas bill	1
3465	meanwhile isi strip club	0
3466	luigi got big tiddies dont support faggot	1
3467	dont understand specific kind stupid admire total commitment	0
3468	literally nobody white people sitting bar put golf channel	1
3469	white people learn fish swim school	1
3470	didnt happen action one man happened people job	0
3471	psst hey european citizen wan na buy illegal meme	0
3472	told back bush liberal republican clothing like mccain	0
3473	hate make u stronger	0
3474	chatting liberal chick bar told open muslim culture raped	1
3475	yeah lazy mexican could quit raping everybody thatd great	1
3476	shia men getting erection behan kidhar hai	0
3477	said woman cant park	0
3478	men pig oink louder others	1
3479	friend house white start stabbing parent dead know peace evil	1
3480	boy pet goat	0
3481	men need walmarts sure dirty youre inside one think im glad	0
3482	chick cant stand fishing	1
3483	day grade sandy hook elementary school	0
3484	modern japanese	0
3485	dont defile lineage given forefather whats right keep white	0
3486	rise refuse shine	0
3487	keeping dishwasher clean make last longer	1
3488	beat drop synagogue	0
3489	blue power tie red power tie white power tie	0
3490	buchenwald concentration camp bone antinazi german woman still brick oven crematorium	0
3491	feel beautiful matter hater say	0
3492	ya partner see unarmed black youth	0
3493	similarity matcha human black one dont work	1
3494	love darling stupid	1
3495	chaos begin anons one chaos like u military stick around gon na helluva ride	0
3496	today making vegetable soup	0
3497	beep beep im milk truck go home bessie youre drunk	0
3498	white people worldwide need know south africa template europe america australia canada jew control white country medium education	1
3499	eat as dick wahabi brother	1
3500	gon na storm nah	0
3501	dont need squad bc squad	0
3502	super rare find kitchen four oven three dishwasher	0
3503	dont like sun wear visor	0
3504	wouldnt stop polar bear	0
3505	femenist men evil must castrated theyre capable want commit rape waiting line best buy	1
3506	love butt fuck goat	1
3507	pour bowl coco puff realize youre outta milk	0
3508	circumcise trump voter kick sister jaw	1
3509	may blind least im dead	0
3510	randomly deciding bake something	1
3511	esther ugly im gon na take yo face stamp sum gorilla cooky	1
3512	much abdul tried could get fucker first gear	0
3513	meanwhile summer camp	0
3514	know wearing extension	0
3515	kid thought black people made anal sex	1
3516	keep youll get regime change	0
3517	bored let watch tv	0
3518	yeah bitch totalinarism sham	0
3519	wan na go masturbate fuck yeah masturbating	1
3520	grand mufti tell youre next suicide bomber attack christian muslim childhood achievement	1
3521	asked middle eastern coworker going blow something week	1
3522	come take	0
3523	alcoholic necrophiliacs common love crack open cold one	1
3524	im really thinking like picture	0
3525	white power	0
3526	dad dishwasher loaded	0
3527	got fired restaurant sticking finger dishwasher im wondering didnt fire	1
3528	teacher monotone voice	0
3529	fifty shade goat isi love story	0
3530	rest peace harambe	0
3531	rebuilt tranny	0
3532	muslim see u	1
3533	chick cant stand fishing	0
3534	muslim varied anybody else islam destructive ideology	1
3535	group sex mohammed tired	0
3536	happen eat wheaties year	0
3537	african like fine killing land white man showed killing u land	1
3538	got africa master look u	0
3539	hitler used cremation oven	0
3540	child left behind child left alive	0
3541	destroy patriarchy simple eat	1
3542	expected pledge allegiance country including america dem representative ilhan omar quote	0
3543	ernie remembers brave soldier fought tonight would reenact bold act smashing jewish neighbor glass window	1
3544	though adore men individually agree group theyre rather stupid	1
3545	dulux color chart matt black gloss black	0
3546	welcome future	0
3547	potato lunch	0
3548	protested trump today mommy who big boy	0
3549	pot hole great way wake	0
3550	someone asks weekend plan old girl need nap	0
3551	ex girfriends like dont even care anymore	0
3552	sex suddenly stopped didnt move hush bitch seen pornhub called buffering	0
3553	symbol stupidity	0
3554	first act getting rid smell brought house	1
3555	spending quality time dad	1
3556	norway rape dinner	0
3557	latest greatest truck come dishwasher	0
3558	pic saying didnt drink much last night friend	0
3559	grew household talking back got as whooped	0
3560	youre gay thats lifestyle choice mean hate gay	1
3561	idiot trump thanks wall im need target practice	0
3562	sorry offended maybe needed offended here apology one thing fuck	0
3563	brother day without blast day wasted zakir naik	0
3564	give holy flag praise lord enslaver	0
3565	hunger game he winning	0
3566	done destroying country well move	0
3567	whats difference walrus lesbian one smell like fish moustache walrus	1
3568	texas church like pew pew pew	0
3569	spook hazzard	1
3570	trump better deal muslim kill	1
3571	ah young grow quickly	0
3572	racist	0
3573	talking shit trump since day one cry like bitch getting called	0
3574	nail point	0
3575	everyone told gon na leave	1
3576	caught goat cheating	1
3577	hate woman much im even joking bro	1
3578	pope vatican	0
3579	black parent white parent	0
3580	great mind think alike	0
3581	fresh fb jail still giving fuck	0
3582	allowed drive took magic carpet ride	1
3583	jamal cycle faster owner coming	1
3584	last summer camp lit	1
3585	little driving music make day	0
3586	gun safety especially important teaching shooting class	0
3587	cotton farm	0
3588	youre way worship allah forgot prayer rug	0
3589	husband husband husband	0
3590	immigrantswave flag invader wave	1
3591	thought prayer go victim	0
3592	black race practice love enemy race practice name religion look condition people look condition black	1
3593	free tommy robinson he nashunal hero today ill prove youre dad	1
3594	hunting hobby way life	0
3595	want found love eachother	0
3596	anything u better anything better	0
3597	youre target practice safely sea	0
3598	real	0
3599	playing ugly hard get yo as already hard want	0
3600	today got cat petcare tip	0
3601	creep child room empty sack	0
3602	goat cant talk muslim rape reported	1
3603	look dad give dont make curfew	0
3604	rose red candle drip wax breaking news man try trade kidnapped baby big mac	0
3605	assassinated joan river trashed obama remember	0
3606	youre muslim oil	1
3607	send location	1
3608	first day prison accidentally drop soap lowkey wasnt accident fun begin	0
3609	bitch like stitch pick open	0
3610	take picture together first time	0
3611	sense humor dark pick cotton	1
3612	yeah bitch kill streak	0
3613	finally self car day	0
3614	said mr president target there walmarts north korea	0
3615	busy like hive bee controlling family see edits news hear youll know think fear till truth gone unless stand en masse	1
3616	like gay iran	0
3617	grow lol nevermind	1
3618	want rape steal murder moral repercussion islam definitely religion	1
3619	aboard headed home	0
3620	look plane uncle samir	1
3621	look bright side half black	0
3622	muslim hunt le muslim	1
3623	race equal	0
3624	im messenger give message cant kill	0
3625	marokko speed dating	1
3626	greater joy u men raping woman goddamn fuck	1
3627	pull yell kobe shot actually go part life within doesnt	0
3628	got crap brain make sure wear diaper	0
3629	stop smoking isnt cigarette ash thats happens lung	0
3630	lock throw away key	0
3631	racist dont appreciate mouthed farm equipment	1
3632	would rate pupper golden	0
3633	pretty much sum islam	1
3634	christian act religious discussion	0
3635	whats burning	1
3636	enter woman restroom mistake	0
3637	black pastor new house negro gatekeeper mental slavery	1
3638	mohammad fucked blink hacker group oink oink hi name mohammad fuck muslim	1
3639	take bottle water africa	0
3640	fresh fb jail still giving fuck	0
3641	government	0
3642	grow lol nevermind	1
3643	ive got problem down syndrome one	1
3644	cash auschwitz bow dach	1
3645	everytime moslem stand congress tell u change constitution impeach president vote socialism remember said would never forget said would destroy u within	1
3646	mandatory vaccination exemption	0
3647	america doesnt need gun ban need idiot ban	0
3648	anytime dog growl excuse shit goddamn french threaten	0
3649	lesbian sex	1
3650	muslim strip club	1
3651	clothes come	0
3652	thing men upset woman lie honest talking talking much showing emotion emotional breathing	1
3653	look told something idiotic like	0
3654	woke last night find tv floating across room first thought ghost turned black guy stealing	1
3655	becomes woman immediately kill person driving	1
3656	manual tranny automatic tranny rebuilt tranny	1
3657	dont rude folk go page wish happy easter	0
3658	feed greed hello im sir trevor chinn control tom watson money zionist	1
3659	maam look found penis	1
3660	didnt let disability hold back	0
3661	love couch understand	0
3662	martin luther king jr rallying community	0
3663	need help swimming	0
3664	mean unless shes dyslexic	1
3665	white kid dont know shoot dad pretend classmate	1
3666	called fuck located	0
3667	im saying shes slag shes seen japseyes asian optician	1
3668	love political correctness tolerance greatest weapon	1
3669	hard first class youre white trash	1
3670	year job million job gained month job job lost	0
3671	body choice	0
3672	become superhero would exmen transformer	1
3673	gas	0
3674	ten cent day help feed child	0
3675	company pride month end	0
3676	cat hear bag open	0
3677	year triggered left	0
3678	buck sex isnt normal meth meth rolling back price farther walmart	1
3679	used cool youre basically mentally retarded year drug abuse fat getting sober friend	1
3680	swore wed never forget took elected office	0
3681	understanding difference nazism hollywood inverted depiction national socialism national socialism	0
3682	damn really thinking making class	1
3683	people dwarfism arguing	0
3684	stoned wife yesterday youre lonely ankle compilaion	0
3685	ask jewsih girl number start rolling sleeve	1
3686	grandparent died holocaust gon na put oven trunk	1
3687	sorry white guy date black guy	0
3688	banner street hulk sheet	0
3689	razor back please	0
3690	im going trans hunting	1
3691	imagine group people filled much hatred make law making illegal hate	1
3692	musslamic democrat ilhan omar threatend member congress shes told several republican shelll send shawarma give taste culture share say arrest	1
3693	im pretty parent white	1
3694	like egg like nigger beaten separated white	1
3695	people walk mile day fresh water dont move closer fucking water	0
3696	typical white man	0
3697	whats difference pizza pizza taste better	0
3698	sure shit talk people like shoot people dont like count something right	0
3699	bout nut cousin hear barn door open	0
3700	look son idiot	0
3701	im sexist sexist wrong wrong woman	1
3702	money cant buy happiness hooker coke dont make sad either	0
3703	youve finished life crime	0
3704	black people became christian	0
3705	bomb every minute	1
3706	person chase show clear sign doesnt want anything im gon na pretend didnt see	0
3707	nein danke im happy gas supplier	0
3708	america could people consider master race	0
3709	went jail sin	0
3710	ach thats car volkswagen car produce gaz expected	1
3711	safe sex isi style	0
3712	put ape rape	0
3713	look give youre new sheik town	0
3714	letter mental disorder	0
3715	disgusting laugh gender dysphoria	0
3716	happens dont spank kid	0
3717	second chloroform chill give look	0
3718	nothing beautiful ironed clothes	0
3719	face as thats way like allah	1
3720	dress dinner girlfriend house parent house	0
3721	white people weird shit black people criminal stereotype exist reason	1
3722	grow lol nevermind	0
3723	slice dice	1
3724	asks send dick pic dick mom mouth	0
3725	nationalism beauty feminism isnt	1
3726	flag represent	0
3727	youve heard elf shelf get ready	0
3728	go ahead call cop cant unrape	0
3729	bruce jenner dog	0
3730	baby small enough fit shoe box take advantage cute baby picture	0
3731	post shit find funny please know offends find shit funny also	0
3732	ignorant history already march life already disarmed	0
3733	dont get started tranny problem	0
3734	letter awesome	0
3735	face make ahmed hit gspot	0
3736	look beautiful muslim woman	0
3737	pauline hanson warns obey rule rule go back came	0
3738	fuck turk never armenian life	1
3739	happy love	0
3740	church america people sleeping street	0
3741	happens white people lose white privilege	1
3742	look tit friend said man ever	0
3743	domestic abuse laughing matter	0
3744	white privilege privilege called racist people see nothing else except color skin	1
3745	gettin hot take ur clothes	1
3746	bos asks need leave early bro im straightup good time	0
3747	black people anything doesnt belong	0
3748	chelsea clinton ugly give head count anal	0
3749	body add another plate sink im washing dish	0
3750	cannibalism	1
3751	mandatory work without exemption nazi see problem	0
3752	isnt black guy clue board game would called solved	1
3753	nut november champion	1
3754	porn christian	0
3755	pug cute hell thats son	0
3756	allah akbar islam religion shouting slogan make people think die terrorist attack	1
3757	wife like hand grenade remove ring house gone	0
3758	fuckin bastard win going hang noose better fix shit hillary clinton email donna brazile october	0
3759	never let anyone tell can not look beethoven everyone told would never musician deaf listen	1
3760	im gnigger youve robbed	1
3761	original black friday sale	0
3762	dont ex y like hell date	0
3763	wife died giving birth daughter youre alone room naked born daughter	0
3764	nein shawty ya bday anne frankly hope celebrate bae	1
3765	told common core purposely designed confusing frustrating parent look ignorant child get confused feel stupid uneducated kid whove programmed depend state answer make much better conformist debt slave future	0
3766	get black guy see baby	0
3767	father christianity pagan sunworship constantine	0
3768	playboy offered million dollar pose nude nat geo offered	1
3769	official white house holiday ornament	0
3770	happy pride month let go beat lesbian	1
3771	halal meat youre looking	0
3772	trump get elected im leaving country like share think leave	0
3773	rosenbergs executed selling nuclear secret russia clinton actually sold nuclear material development weaponsto russia	0
3774	section australian constitution person allegiance foreign power entitled seat government un foreign power	0
3775	piggy back ride racing friend one way get cardio	0
3776	liking ur fb post	0
3777	dear mrsimtoogoodtoanswermydms last dick pic ever send as month still nude dont deserve know got last dick pic put filter perfect	0
3778	knowing white people thats probably baby father	0
3779	girl problem throw acid bitch	1
3780	fuck catholic fuck catholic church fuck pope	1
3781	kid africa dancing good time	0
3782	show pta meeting know kid little shit	0
3783	oh boy cant wait clean shower guard taking u	0
3784	making america white	0
3785	pet niguana sale come food dish toy screen lid cant get obo	1
3786	take zoo said theyll learn something new said	0
3787	retarded kill u must	1
3788	throwing gay one boy	1
3789	watch ill put bomb car	1
3790	goat look wiser	0
3791	eat bacon sex	0
3792	said choke daddy gave popeyes biscuit without drink	0
3793	stonger man one hope	0
3794	daily activity log got	0
3795	wear public section steal	1
3796	banged girl stutter finished could say	1
3797	greeting white person time die	1
3798	mississippi wind chime	0
3799	happy pride month yall disney proudly present gentleman tranny	1
3800	high school got brace friend told youre black even teeth behind bar	1
3801	black power come responsibility	1
3802	happy stupid	0
3803	presidency isi caliphate blm antifa war police built	0
3804	say lot bad thing pedophile least drive slowly past school	0
3805	oh boy cant wait visit notre dame cathedral april fuck french fuck french bunch gay cuckholds	1
3806	wan na watch porn golf porn already know golf	0
3807	say allahu akbar go aheadsay	1
3808	said go bitch bitch bitch	0
3809	make harder criminal get gun even prevent one tragedy let make harder pervert use lady room even prevent rape one	0
3810	family mexico crossing border	0
3811	got phone wet try leaving dry rice overnight attract asian fix electronics	1
3812	kid pig please dont get u confused	0
3813	owns ice cream shop	0
3814	warms heart seeing father spending time woth kid	0
3815	texas church like pew pew pew	0
3816	red bull give wing vodka give	0
3817	extremist brain washing child	0
3818	mamma hungry	0
3819	got brace friend told youre black even teeth behind bar	1
3820	dont understand specific kind stupid admire total commitment	0
3821	rosie donnell removed home today make good threat leave u donald trump became president	0
3822	long run till chain tightens	0
3823	please tell happens people	0
3824	tell islamic friend can not go plane right keep life	1
3825	youre fuhrking back say ill pay gas bill daddy	0
3826	catch goat another man	0
3827	come acting scarlett johansson amazing tit	0
3828	look youre black celebrate july	1
3829	nevr forget said didnt forget fighting together	0
3830	dear diary miss fucking	0
3831	like sperm get million one work	0
3832	stop illegal immigrant theyre taking land stole	0
3833	monday got like	0
3834	portable dishwasher slash sandwich maker	0
3835	join democrat party indulge deep seated supremacist proclivity helping minority also love black cock	1
3836	dont talk he gay shut bitch	0
3837	dishwasher done good	1
3838	dark humor like food everyone get justnorthkoreathings	0
3839	dont embrassed mark lot guy yell harder daddy rectal exam	0
3840	listen sweetheart let sink never owned slave never picked cotton end lesson dont owe shit	1
3841	german s soldier punishing small jewish boy sticking sharpened spear boy anus auschwitz concentration camp poland colorized	1
3842	muslim terrorist	0
3843	iroc z italian retard cruising	1
3844	racing pink slip africa	1
3845	oh youre triggered must hard special snowflake	0
3846	cop see unarmed black youth	1
3847	man accused raping old daughter friend deny accusation thenthe girl committed suicide said lying democrat protected po	0
3848	thank much ariana grande youre welcome	0
3849	finally brotherslayer spawn killer strength youre still nothing nigger	1
3850	favorite animal carrot	0
3851	thats wrong america white people	1
3852	girl killing cockroach boy killing million jew	1
3853	muslim sex goat wipe ass hand drink camel piss im unclean one	1
3854	subway similar prostitution pay someone else wife job	1
3855	maury show way time	1
3856	valentine islamic country	1
3857	isi mean goat fucker dont like bacon	0
3858	youre cutting onion infront wife youre trying hold tear	0
3859	oh look new dishwasher arrived	0
3860	isnt even final form	1
3861	know aint got class muthafucka	0
3862	home depot check new kenyan fly strip	1
3863	islam religion peace stop criticizing religion	1
3864	femenist men evil must castrated theyre capable want commit rape waiting line best buy neat	1
3865	like one kid remember	0
3866	catch goat another man ya done fucked	0
3867	fuck muhammed pig fucker	1
3868	take monkey shit embarassin u	0
3869	moment threesome	0
3870	jesus love welcome homosexual heav dont decieved homosexual inherit kingdom god	1
3871	rape whistle im afraid use admire optimism	0
3872	im going kill gay make slavery legal take away woman right im muslim	1
3873	great punching bag	1
3874	cheer hater patient much coming	0
3875	let end racism together	0
